{
  "schema_version": 1,
  "freeze_id": "mocc.freeze.protocols_rules.2026_07_22",
  "created_at": "2026-07-22",
  "status": "frozen",
  "registry_path": "configs/metadata_rules/rule_registry_v2.json",
  "protocol_directory": "configs/metadata_protocols",
  "artifacts": [
    {
      "path": "configs/filesystem_bindings/btrfs_path_allocation_v1.json",
      "artifact_kind": "binding",
      "logical_id": "btrfs.path_allocation",
      "schema_version": 1,
      "semantic_version": "1.0.0",
      "content_sha256": "2a7fdebd0f25ef9df11dec0475fc87de91e2c2cd730b65086387ee07b2b4178b"
    },
    {
      "path": "configs/filesystem_bindings/ext4_journal_transaction_v1.json",
      "artifact_kind": "binding",
      "logical_id": "ext4.journal_transaction",
      "schema_version": 1,
      "semantic_version": "1.0.0",
      "content_sha256": "eac72f90ae151fbf8fdb8dccecbca1fc9818d2c9f56c9ee039f3109fc4cb538a"
    },
    {
      "path": "configs/filesystem_bindings/xfs_transaction_v1.json",
      "artifact_kind": "binding",
      "logical_id": "xfs.transaction",
      "schema_version": 1,
      "semantic_version": "1.0.0",
      "content_sha256": "31184f16f6c4f8516b1c5531d0f8e9f1c68025fc8649bcd10b85c750f1f2101c"
    },
    {
      "path": "configs/metadata_protocols/protocol_a_replay_recovery_v1.json",
      "artifact_kind": "protocol_manifest",
      "logical_id": "mocc.protocol_a.replay_recovery",
      "schema_version": 1,
      "semantic_version": "1.0.0",
      "content_sha256": "8da44988747a893ae89f757186d912589d5809252596d3450b53bdf7dd0311d1"
    },
    {
      "path": "configs/metadata_protocols/protocol_b_device_topology_v1.json",
      "artifact_kind": "protocol_manifest",
      "logical_id": "mocc.protocol_b.device_topology_rollback",
      "schema_version": 1,
      "semantic_version": "1.0.0",
      "content_sha256": "b27fd750dd4295db72778603462ab7a2d50511effca9e32d59ac1843c136bcd3"
    },
    {
      "path": "configs/metadata_protocols/protocol_c_activation_accounting_v1.json",
      "artifact_kind": "protocol_manifest",
      "logical_id": "mocc.protocol_c.activation_accounting",
      "schema_version": 1,
      "semantic_version": "1.0.0",
      "content_sha256": "5d2d6269f2fcea4fc1b2598a7532cda44f0575eb2c84a94e05edde54f777b14c"
    },
    {
      "path": "configs/metadata_protocols/protocol_d_transaction_lifecycle_v2.json",
      "artifact_kind": "protocol_manifest",
      "logical_id": "mocc.protocol_d.transaction_lifecycle",
      "schema_version": 1,
      "semantic_version": "1.1.0",
      "content_sha256": "b8a14bb303a2445852920606c06a6217a12c0bac00011d2bb088ec4e1a9fc52b"
    },
    {
      "path": "configs/metadata_protocols/protocol_e_allocation_lifecycle_v2.json",
      "artifact_kind": "protocol_manifest",
      "logical_id": "mocc.protocol_e.allocation_lifecycle",
      "schema_version": 1,
      "semantic_version": "1.1.0",
      "content_sha256": "1e6383a4c886c291af03c917897a5f0b6dfec0cad6d7d18ddbc84475ff042f82"
    },
    {
      "path": "configs/metadata_rules/rule_registry_v2.json",
      "artifact_kind": "registry",
      "logical_id": "mocc.metadata_rules",
      "schema_version": 2,
      "semantic_version": "2.2.0",
      "content_sha256": "030dddf3da79ba0263329d24eb72d6211340fb2f4d6585e4d38a5c20cc8de80f"
    },
    {
      "path": "configs/operations/btrfs_parent_lookup_path_allocation_v1.json",
      "artifact_kind": "operation",
      "logical_id": "btrfs_parent_lookup_path_allocation",
      "schema_version": 1,
      "semantic_version": "1.0.0",
      "content_sha256": "bc30c94d09b17eb9bd8f831d7e90b6ca20bb7e876797221291343e0253ff44f6"
    },
    {
      "path": "configs/operations/ext4_verity_journal_transaction_v1.json",
      "artifact_kind": "operation",
      "logical_id": "ext4_verity_journal_transaction",
      "schema_version": 1,
      "semantic_version": "1.0.0",
      "content_sha256": "8b4c27f6a57dd949e292d4e41efc48d46dd38477ebbd09d8c10fdd4bcff24400"
    },
    {
      "path": "configs/operations/xfs_acl_mode_transaction_v1.json",
      "artifact_kind": "operation",
      "logical_id": "xfs_acl_mode_transaction",
      "schema_version": 1,
      "semantic_version": "1.0.0",
      "content_sha256": "fccb965f81292ddf2d5071f33e3875988facb55541982e32541f29169f21e0ee"
    },
    {
      "path": "configs/protocol_families/allocation_lifecycle_v1.json",
      "artifact_kind": "family",
      "logical_id": "allocation_lifecycle",
      "schema_version": 1,
      "semantic_version": "1.0.0",
      "content_sha256": "ce244d26dec8b89b9ecfb37f9c8195b04f2a163e9c55c1bf31a45537478dfa0b"
    },
    {
      "path": "configs/protocol_families/transaction_lifecycle_v1.json",
      "artifact_kind": "family",
      "logical_id": "transaction_lifecycle",
      "schema_version": 1,
      "semantic_version": "1.0.0",
      "content_sha256": "a2fbc0a5e43016a7d69782993b43b75de9e252973162cba0919b1ad254ce1412"
    }
  ]
}
